guidislink,href,id,link,links,media_thumbnail,published,published_parsed,summary,summary_detail,title,title_detail,scraping_date
False,,https://www.sciencedaily.com/releases/2018/09/180912133458.htm,https://www.sciencedaily.com/releases/2018/09/180912133458.htm,"[{'rel': 'alternate', 'type': 'text/html', 'href': 'https://www.sciencedaily.com/releases/2018/09/180912133458.htm'}]","[{'url': 'https://www.sciencedaily.com/images/2018/09/180912133458-large.jpg', 'height': '225', 'width': '300'}]","Wed, 12 Sep 2018 13:34:58 EDT","[2018, 9, 12, 17, 34, 58, 2, 255, 0]","A scientific analysis of nearly 4,000 mutations deliberately engineered into the BRCA1 gene will immediately benefit people undergoing genetic testing for breast or ovarian cancer risk. Many people obtaining genetic screenings previoulsy have learned that their BRCA1 gene contains a variant of uncertain significance. Data from this study now categorizes thousands of variants as behaving like disease mutations or not, providing new information important for medical care decisions.","{'type': 'text/html', 'language': None, 'base': 'https://www.sciencedaily.com/rss/health_medicine/personalized_medicine.xml', 'value': 'A scientific analysis of nearly 4,000 mutations deliberately engineered into the BRCA1 gene will immediately benefit people undergoing genetic testing for breast or ovarian cancer risk. Many people obtaining genetic screenings previoulsy have learned that their BRCA1 gene contains a variant of uncertain significance. Data from this study now categorizes thousands of variants as behaving like disease mutations or not, providing new information important for medical care decisions.'}",Thousands of breast cancer gene variants engineered and analyzed,"{'type': 'text/plain', 'language': None, 'base': 'https://www.sciencedaily.com/rss/health_medicine/personalized_medicine.xml', 'value': 'Thousands of breast cancer gene variants engineered and analyzed'}",2019-03-27 15:47:31.683934
False,,https://www.sciencedaily.com/releases/2019/03/190325101413.htm,https://www.sciencedaily.com/releases/2019/03/190325101413.htm,"[{'rel': 'alternate', 'type': 'text/html', 'href': 'https://www.sciencedaily.com/releases/2019/03/190325101413.htm'}]","[{'url': 'https://www.sciencedaily.com/images/2019/03/190325101413-large.jpg', 'height': '193', 'width': '300'}]","Mon, 25 Mar 2019 10:14:13 EDT","[2019, 3, 25, 14, 14, 13, 0, 84, 0]","A sophisticated new analysis too incorporating advanced mathematical strategies could help revolutionize the way researchers investigate the spread and distribution of dangerous, fast-evolving disease vectors.","{'type': 'text/html', 'language': None, 'base': 'https://www.sciencedaily.com/rss/health_medicine/genes.xml', 'value': 'A sophisticated new analysis too incorporating advanced mathematical strategies could help revolutionize the way researchers investigate the spread and distribution of dangerous, fast-evolving disease vectors.'}",New computational tool could change how we study pathogens,"{'type': 'text/plain', 'language': None, 'base': 'https://www.sciencedaily.com/rss/health_medicine/genes.xml', 'value': 'New computational tool could change how we study pathogens'}",2019-03-27 15:47:31.683934
False,,https://www.sciencedaily.com/releases/2019/01/190130103742.htm,https://www.sciencedaily.com/releases/2019/01/190130103742.htm,"[{'rel': 'alternate', 'type': 'text/html', 'href': 'https://www.sciencedaily.com/releases/2019/01/190130103742.htm'}]","[{'url': 'https://www.sciencedaily.com/images/2019/01/190130103742-large.jpg', 'height': '304', 'width': '300'}]","Wed, 30 Jan 2019 10:37:42 EST","[2019, 1, 30, 15, 37, 42, 2, 30, 0]","Adding functional imaging to structural imaging of patients with ventricular tachycardia (VT) has the potential to improve current VT ablation strategies, according to new research.","{'type': 'text/html', 'language': None, 'base': 'https://www.sciencedaily.com/rss/health_medicine/medical_devices.xml', 'value': 'Adding functional imaging to structural imaging of patients with ventricular tachycardia (VT) has the potential to improve current VT ablation strategies, according to new research.'}",Combined SPECT and cardiac MR imaging can help guide ventricular tachycardia ablation,"{'type': 'text/plain', 'language': None, 'base': 'https://www.sciencedaily.com/rss/health_medicine/medical_devices.xml', 'value': 'Combined SPECT and cardiac MR imaging can help guide ventricular tachycardia ablation'}",2019-03-27 15:47:31.683934
False,,https://www.sciencedaily.com/releases/2018/01/180130090855.htm,https://www.sciencedaily.com/releases/2018/01/180130090855.htm,"[{'rel': 'alternate', 'type': 'text/html', 'href': 'https://www.sciencedaily.com/releases/2018/01/180130090855.htm'}]","[{'url': 'https://www.sciencedaily.com/images/2018/01/180130090855-large.jpg', 'height': '225', 'width': '300'}]","Tue, 30 Jan 2018 09:08:55 EST","[2018, 1, 30, 14, 8, 55, 1, 30, 0]","Medical students who spend more time engaging in the arts may also be bolstering the qualities that improve their bedside manner with patients, according to new research. The study finds that students who devoted more time to the humanities during medical school had significantly higher levels of positive physician attributes like empathy, tolerance of ambiguity, wisdom and emotional intelligence while at the same time reporting lower levels of adverse traits like burnout.","{'type': 'text/html', 'language': None, 'base': 'https://www.sciencedaily.com/rss/health_medicine/medical_education_and_training.xml', 'value': 'Medical students who spend more time engaging in the arts may also be bolstering the qualities that improve their bedside manner with patients, according to new research. The study finds that students who devoted more time to the humanities during medical school had significantly higher levels of positive physician attributes like empathy, tolerance of ambiguity, wisdom and emotional intelligence while at the same time reporting lower levels of adverse traits like burnout.'}",Arts and humanities in medical school promote empathy and inoculate against burnout,"{'type': 'text/plain', 'language': None, 'base': 'https://www.sciencedaily.com/rss/health_medicine/medical_education_and_training.xml', 'value': 'Arts and humanities in medical school promote empathy and inoculate against burnout'}",2019-03-27 15:47:31.683934
False,,https://www.sciencedaily.com/releases/2019/03/190320141039.htm,https://www.sciencedaily.com/releases/2019/03/190320141039.htm,"[{'rel': 'alternate', 'type': 'text/html', 'href': 'https://www.sciencedaily.com/releases/2019/03/190320141039.htm'}]","[{'url': 'https://www.sciencedaily.com/images/2019/03/190320141039-large.jpg', 'height': '200', 'width': '300'}]","Wed, 20 Mar 2019 14:10:39 EDT","[2019, 3, 20, 18, 10, 39, 2, 79, 0]",A toilet-seat based cardiovascular monitoring system aims to lower the hospital readmission rates of patients with congestive heart failure.,"{'type': 'text/html', 'language': None, 'base': 'https://www.sciencedaily.com/rss/health_medicine/heart_disease.xml', 'value': 'A toilet-seat based cardiovascular monitoring system aims to lower the hospital readmission rates of patients with congestive heart failure.'}",Toilet seat that detects congestive heart failure getting ready to begin commercialization,"{'type': 'text/plain', 'language': None, 'base': 'https://www.sciencedaily.com/rss/health_medicine/heart_disease.xml', 'value': 'Toilet seat that detects congestive heart failure getting ready to begin commercialization'}",2019-03-27 15:47:31.683934
False,,https://www.sciencedaily.com/releases/2019/02/190225133715.htm,https://www.sciencedaily.com/releases/2019/02/190225133715.htm,"[{'rel': 'alternate', 'type': 'text/html', 'href': 'https://www.sciencedaily.com/releases/2019/02/190225133715.htm'}]","[{'url': 'https://www.sciencedaily.com/images/2019/02/190225133715-large.jpg', 'height': '169', 'width': '300'}]","Mon, 25 Feb 2019 13:37:15 EST","[2019, 2, 25, 18, 37, 15, 0, 56, 0]",Neuroscientists have used CRISPR/Cas9 genome editing technology to regulate genes in the rat brain. This technique paves the way for researchers to probe genetic influences on brain health and disease in model organisms that more closely resemble human conditions.,"{'type': 'text/html', 'language': None, 'base': 'https://www.sciencedaily.com/rss/health_medicine/nervous_system.xml', 'value': 'Neuroscientists have used CRISPR/Cas9 genome editing technology to regulate genes in the rat brain. This technique paves the way for researchers to probe genetic influences on brain health and disease in model organisms that more closely resemble human conditions.'}",Manipulating gene expression in neurons with CRISPR,"{'type': 'text/plain', 'language': None, 'base': 'https://www.sciencedaily.com/rss/health_medicine/nervous_system.xml', 'value': 'Manipulating gene expression in neurons with CRISPR'}",2019-03-27 15:47:31.683934
False,,https://www.sciencedaily.com/releases/2019/03/190326122145.htm,https://www.sciencedaily.com/releases/2019/03/190326122145.htm,"[{'rel': 'alternate', 'type': 'text/html', 'href': 'https://www.sciencedaily.com/releases/2019/03/190326122145.htm'}]","[{'url': 'https://www.sciencedaily.com/images/2019/03/190326122145-large.jpg', 'height': '199', 'width': '300'}]","Tue, 26 Mar 2019 12:21:45 EDT","[2019, 3, 26, 16, 21, 45, 1, 85, 0]",New work repurposing one of the oldest known reagents for amyloid looks to help provide a clearer picture of how fibrils come together.,"{'type': 'text/html', 'language': None, 'base': 'https://www.sciencedaily.com/rss/health_medicine/medical_imaging.xml', 'value': 'New work repurposing one of the oldest known reagents for amyloid looks to help provide a clearer picture of how fibrils come together.'}",Technique uses well-known dye to watch amyloid plaques in the brain,"{'type': 'text/plain', 'language': None, 'base': 'https://www.sciencedaily.com/rss/health_medicine/medical_imaging.xml', 'value': 'Technique uses well-known dye to watch amyloid plaques in the brain'}",2019-03-27 15:47:31.683934
False,,https://www.sciencedaily.com/releases/2017/10/171030112252.htm,https://www.sciencedaily.com/releases/2017/10/171030112252.htm,"[{'rel': 'alternate', 'type': 'text/html', 'href': 'https://www.sciencedaily.com/releases/2017/10/171030112252.htm'}]","[{'url': 'https://www.sciencedaily.com/images/2017/10/171030112252-large.jpg', 'height': '222', 'width': '300'}]","Mon, 30 Oct 2017 11:22:52 EDT","[2017, 10, 30, 15, 22, 52, 0, 303, 0]","Female medical interns are more likely to suffer from symptoms of depression than their male counterparts, and the conflict between work and family responsibilities is a factor in that gender difference about a third of the time, suggests research.","{'type': 'text/html', 'language': None, 'base': 'https://www.sciencedaily.com/rss/health_medicine/medical_education_and_training.xml', 'value': 'Female medical interns are more likely to suffer from symptoms of depression than their male counterparts, and the conflict between work and family responsibilities is a factor in that gender difference about a third of the time, suggests research.'}",Work-family balance can tip wrong way for some young doctors,"{'type': 'text/plain', 'language': None, 'base': 'https://www.sciencedaily.com/rss/health_medicine/medical_education_and_training.xml', 'value': 'Work-family balance can tip wrong way for some young doctors'}",2019-03-27 15:47:31.683934
False,,https://www.sciencedaily.com/releases/2019/02/190219132836.htm,https://www.sciencedaily.com/releases/2019/02/190219132836.htm,"[{'rel': 'alternate', 'type': 'text/html', 'href': 'https://www.sciencedaily.com/releases/2019/02/190219132836.htm'}]","[{'url': 'https://www.sciencedaily.com/images/2019/02/190219132836-large.jpg', 'height': '344', 'width': '300'}]","Tue, 19 Feb 2019 13:28:36 EST","[2019, 2, 19, 18, 28, 36, 1, 50, 0]",Study shows new forms of an older anti-cancer agent appear to enhance the immune system's ability to fight melanoma in mice.,"{'type': 'text/html', 'language': None, 'base': 'https://www.sciencedaily.com/rss/health_medicine/pharmaceuticals.xml', 'value': ""Study shows new forms of an older anti-cancer agent appear to enhance the immune system's ability to fight melanoma in mice.""}",New one-two punch against melanoma in mouse model,"{'type': 'text/plain', 'language': None, 'base': 'https://www.sciencedaily.com/rss/health_medicine/pharmaceuticals.xml', 'value': 'New one-two punch against melanoma in mouse model'}",2019-03-27 15:47:31.683934
False,,https://www.sciencedaily.com/releases/2019/02/190205185207.htm,https://www.sciencedaily.com/releases/2019/02/190205185207.htm,"[{'rel': 'alternate', 'type': 'text/html', 'href': 'https://www.sciencedaily.com/releases/2019/02/190205185207.htm'}]","[{'url': 'https://www.sciencedaily.com/images/2019/02/190205185207-large.jpg', 'height': '208', 'width': '300'}]","Tue, 05 Feb 2019 18:52:07 EST","[2019, 2, 5, 23, 52, 7, 1, 36, 0]",Researchers successfully used stem cells to grow mouse kidneys inside rats.,"{'type': 'text/html', 'language': None, 'base': 'https://www.sciencedaily.com/rss/health_medicine/stem_cells.xml', 'value': 'Researchers successfully used stem cells to grow mouse kidneys inside rats.'}",One step closer to growing made-to-order human kidneys,"{'type': 'text/plain', 'language': None, 'base': 'https://www.sciencedaily.com/rss/health_medicine/stem_cells.xml', 'value': 'One step closer to growing made-to-order human kidneys'}",2019-03-27 15:47:31.683934
False,,https://www.sciencedaily.com/releases/2018/05/180522114559.htm,https://www.sciencedaily.com/releases/2018/05/180522114559.htm,"[{'rel': 'alternate', 'type': 'text/html', 'href': 'https://www.sciencedaily.com/releases/2018/05/180522114559.htm'}]","[{'url': 'https://www.sciencedaily.com/images/2018/05/180522114559-large.jpg', 'height': '171', 'width': '300'}]","Tue, 22 May 2018 11:45:59 EDT","[2018, 5, 22, 15, 45, 59, 1, 142, 0]","During embryonic development genetic cascades control gene activity and cell differentiation. Researchers reported that besides the genetic program, also mechanical cues can contribute to the regulation of gene expression during development. Comparisons with other animals suggests that this regulatory principle is ancient.","{'type': 'text/html', 'language': None, 'base': 'https://www.sciencedaily.com/rss/health_medicine/gene_therapy.xml', 'value': 'During embryonic development genetic cascades control gene activity and cell differentiation. Researchers reported that besides the genetic program, also mechanical cues can contribute to the regulation of gene expression during development. Comparisons with other animals suggests that this regulatory principle is ancient.'}",Embryonic gene regulation through mechanical forces,"{'type': 'text/plain', 'language': None, 'base': 'https://www.sciencedaily.com/rss/health_medicine/gene_therapy.xml', 'value': 'Embryonic gene regulation through mechanical forces'}",2019-03-27 15:47:31.683934
False,,https://www.sciencedaily.com/releases/2019/01/190117142144.htm,https://www.sciencedaily.com/releases/2019/01/190117142144.htm,"[{'rel': 'alternate', 'type': 'text/html', 'href': 'https://www.sciencedaily.com/releases/2019/01/190117142144.htm'}]","[{'url': 'https://www.sciencedaily.com/images/2019/01/190117142144-large.jpg', 'height': '200', 'width': '300'}]","Thu, 17 Jan 2019 14:21:44 EST","[2019, 1, 17, 19, 21, 44, 3, 17, 0]","Scientists have developed a gene therapy that blocks axonal degeneration, preventing axon destruction in mice and suggesting a therapeutic strategy that could help prevent the loss of peripheral nerves in multiple conditions.","{'type': 'text/html', 'language': None, 'base': 'https://www.sciencedaily.com/rss/health_medicine/gene_therapy.xml', 'value': 'Scientists have developed a gene therapy that blocks axonal degeneration, preventing axon destruction in mice and suggesting a therapeutic strategy that could help prevent the loss of peripheral nerves in multiple conditions.'}",Gene therapy blocks peripheral nerve damage in mice,"{'type': 'text/plain', 'language': None, 'base': 'https://www.sciencedaily.com/rss/health_medicine/gene_therapy.xml', 'value': 'Gene therapy blocks peripheral nerve damage in mice'}",2019-03-27 15:47:31.683934
False,,https://www.sciencedaily.com/releases/2019/02/190220103346.htm,https://www.sciencedaily.com/releases/2019/02/190220103346.htm,"[{'rel': 'alternate', 'type': 'text/html', 'href': 'https://www.sciencedaily.com/releases/2019/02/190220103346.htm'}]","[{'url': 'https://www.sciencedaily.com/images/2019/02/190220103346-large.jpg', 'height': '169', 'width': '300'}]","Wed, 20 Feb 2019 10:33:46 EST","[2019, 2, 20, 15, 33, 46, 2, 51, 0]",Research has uncovered the roles of two types of cells found in the vessel walls of fat tissue and described how these cells may help speed bone repair.,"{'type': 'text/html', 'language': None, 'base': 'https://www.sciencedaily.com/rss/health_medicine/stem_cells.xml', 'value': 'Research has uncovered the roles of two types of cells found in the vessel walls of fat tissue and described how these cells may help speed bone repair.'}",Researchers define cells used in bone repair,"{'type': 'text/plain', 'language': None, 'base': 'https://www.sciencedaily.com/rss/health_medicine/stem_cells.xml', 'value': 'Researchers define cells used in bone repair'}",2019-03-27 15:47:31.683934
False,,https://www.sciencedaily.com/releases/2019/03/190314151546.htm,https://www.sciencedaily.com/releases/2019/03/190314151546.htm,"[{'rel': 'alternate', 'type': 'text/html', 'href': 'https://www.sciencedaily.com/releases/2019/03/190314151546.htm'}]","[{'url': 'https://www.sciencedaily.com/images/2019/03/190314151546-large.jpg', 'height': '174', 'width': '300'}]","Thu, 14 Mar 2019 15:15:46 EDT","[2019, 3, 14, 19, 15, 46, 3, 73, 0]","Researchers are shedding new light on how animals perform whole-body regeneration, and uncovered a number of DNA switches that appear to control genes used in the process.","{'type': 'text/html', 'language': None, 'base': 'https://www.sciencedaily.com/rss/health_medicine/genes.xml', 'value': 'Researchers are shedding new light on how animals perform whole-body regeneration, and uncovered a number of DNA switches that appear to control genes used in the process.'}",Study uncovers genetic switches that control process of whole-body regeneration,"{'type': 'text/plain', 'language': None, 'base': 'https://www.sciencedaily.com/rss/health_medicine/genes.xml', 'value': 'Study uncovers genetic switches that control process of whole-body regeneration'}",2019-03-27 15:47:31.683934
False,,https://www.sciencedaily.com/releases/2018/12/181211091931.htm,https://www.sciencedaily.com/releases/2018/12/181211091931.htm,"[{'rel': 'alternate', 'type': 'text/html', 'href': 'https://www.sciencedaily.com/releases/2018/12/181211091931.htm'}]","[{'url': 'https://www.sciencedaily.com/images/2018/12/181211091931-large.jpg', 'height': '312', 'width': '300'}]","Tue, 11 Dec 2018 09:19:31 EST","[2018, 12, 11, 14, 19, 31, 1, 345, 0]","Human norovirus is a major cause of infections that can be particularly dangerous to children and elderly people. Here, a research team found that human induced pluripotent stem cell-derived intestinal epithelial cells allowed for efficient growth of human norovirus in the laboratory, without requiring human tissue or bile. This method raises fewer practical and ethical issues than conventional systems and should prove useful for industrial applications such as testing new potential vaccines.","{'type': 'text/html', 'language': None, 'base': 'https://www.sciencedaily.com/rss/health_medicine/vaccines.xml', 'value': 'Human norovirus is a major cause of infections that can be particularly dangerous to children and elderly people. Here, a research team found that human induced pluripotent stem cell-derived intestinal epithelial cells allowed for efficient growth of human norovirus in the laboratory, without requiring human tissue or bile. This method raises fewer practical and ethical issues than conventional systems and should prove useful for industrial applications such as testing new potential vaccines.'}",Going viral: New cells for norovirus production in the lab,"{'type': 'text/plain', 'language': None, 'base': 'https://www.sciencedaily.com/rss/health_medicine/vaccines.xml', 'value': 'Going viral: New cells for norovirus production in the lab'}",2019-03-27 15:47:31.683934
False,,https://www.sciencedaily.com/releases/2019/03/190320101941.htm,https://www.sciencedaily.com/releases/2019/03/190320101941.htm,"[{'rel': 'alternate', 'type': 'text/html', 'href': 'https://www.sciencedaily.com/releases/2019/03/190320101941.htm'}]","[{'url': 'https://www.sciencedaily.com/images/2019/03/190320101941-large.jpg', 'height': '450', 'width': '300'}]","Wed, 20 Mar 2019 10:19:41 EDT","[2019, 3, 20, 14, 19, 41, 2, 79, 0]",We all know the feeling of a mobile phone vibrating in our hands. We perceive these vibrations so clearly thanks to specialized receptors that transduce them into neural signals sent to our brain. But how does the latter encode their physical characteristics? Neuroscientists have discovered that feeling a phone vibrate or hearing it ring is ultimately based on the same brain codes.,"{'type': 'text/html', 'language': None, 'base': 'https://www.sciencedaily.com/rss/health_medicine/nervous_system.xml', 'value': 'We all know the feeling of a mobile phone vibrating in our hands. We perceive these vibrations so clearly thanks to specialized receptors that transduce them into neural signals sent to our brain. But how does the latter encode their physical characteristics? Neuroscientists have discovered that feeling a phone vibrate or hearing it ring is ultimately based on the same brain codes.'}",How our body 'listens' to vibrations,"{'type': 'text/plain', 'language': None, 'base': 'https://www.sciencedaily.com/rss/health_medicine/nervous_system.xml', 'value': ""How our body 'listens' to vibrations""}",2019-03-27 15:47:31.683934
False,,https://www.sciencedaily.com/releases/2019/03/190321092246.htm,https://www.sciencedaily.com/releases/2019/03/190321092246.htm,"[{'rel': 'alternate', 'type': 'text/html', 'href': 'https://www.sciencedaily.com/releases/2019/03/190321092246.htm'}]","[{'url': 'https://www.sciencedaily.com/images/2019/03/190321092246-large.jpg', 'height': '300', 'width': '300'}]","Thu, 21 Mar 2019 09:22:46 EDT","[2019, 3, 21, 13, 22, 46, 3, 80, 0]","Cells of the retinal pigment epithelium (RPE) form unique patterns that can be used to track changes in this important layer of tissue in the back of the eye, researchers have found. Using a combination of adaptive optics imaging and a fluorescent dye, the researchers used the RPE patterns to track individual cells in healthy volunteers and people with retinal disease.","{'type': 'text/html', 'language': None, 'base': 'https://www.sciencedaily.com/rss/health_medicine/medical_imaging.xml', 'value': 'Cells of the retinal pigment epithelium (RPE) form unique patterns that can be used to track changes in this important layer of tissue in the back of the eye, researchers have found. Using a combination of adaptive optics imaging and a fluorescent dye, the researchers used the RPE patterns to track individual cells in healthy volunteers and people with retinal disease.'}",Imaging method reveals long-lived patterns in cells of the eye,"{'type': 'text/plain', 'language': None, 'base': 'https://www.sciencedaily.com/rss/health_medicine/medical_imaging.xml', 'value': 'Imaging method reveals long-lived patterns in cells of the eye'}",2019-03-27 15:47:31.683934
False,,https://www.sciencedaily.com/releases/2019/03/190314151551.htm,https://www.sciencedaily.com/releases/2019/03/190314151551.htm,"[{'rel': 'alternate', 'type': 'text/html', 'href': 'https://www.sciencedaily.com/releases/2019/03/190314151551.htm'}]","[{'url': 'https://www.sciencedaily.com/images/2019/03/190314151551-large.jpg', 'height': '225', 'width': '300'}]","Thu, 14 Mar 2019 15:15:51 EDT","[2019, 3, 14, 19, 15, 51, 3, 73, 0]","Researchers have analyzed ancient DNA from almost 300 individuals from the Iberian Peninsula, spanning more than 12,000 years. The first study looked at hunter-gatherers and early farmers living in Iberia between 13,000 and 6,000 years ago. The second looked at individuals from the region over the last 8000 years. Together, the two papers greatly increase our knowledge about the population history of this unique region.","{'type': 'text/html', 'language': None, 'base': 'https://www.sciencedaily.com/rss/health_medicine/genes.xml', 'value': 'Researchers have analyzed ancient DNA from almost 300 individuals from the Iberian Peninsula, spanning more than 12,000 years. The first study looked at hunter-gatherers and early farmers living in Iberia between 13,000 and 6,000 years ago. The second looked at individuals from the region over the last 8000 years. Together, the two papers greatly increase our knowledge about the population history of this unique region.'}",Unique diversity of the genetic history of the Iberian Peninsula revealed by dual studies,"{'type': 'text/plain', 'language': None, 'base': 'https://www.sciencedaily.com/rss/health_medicine/genes.xml', 'value': 'Unique diversity of the genetic history of the Iberian Peninsula revealed by dual studies'}",2019-03-27 15:47:31.683934
