guidislink,href,id,link,links,media_thumbnail,published,published_parsed,summary,summary_detail,title,title_detail,scraping_date
False,,https://www.sciencedaily.com/releases/2019/03/190317150424.htm,https://www.sciencedaily.com/releases/2019/03/190317150424.htm,"[{'rel': 'alternate', 'type': 'text/html', 'href': 'https://www.sciencedaily.com/releases/2019/03/190317150424.htm'}]","[{'url': 'https://www.sciencedaily.com/images/2019/03/190317150424-large.jpg', 'height': '146', 'width': '300'}]","Sun, 17 Mar 2019 15:04:24 EDT","[2019, 3, 17, 19, 4, 24, 6, 76, 0]","A novel electrocardiogram (ECG) method uses signals from the ear and hand to check heart rhythm. The ECG does not require two hands and could be used by drivers, athletes, and the military.","{'type': 'text/html', 'language': None, 'base': 'https://www.sciencedaily.com/rss/health_medicine/heart_disease.xml', 'value': 'A novel electrocardiogram (ECG) method uses signals from the ear and hand to check heart rhythm. The ECG does not require two hands and could be used by drivers, athletes, and the military.'}",Novel electrocardiogram uses signals from ear and hand to check heart rhythm,"{'type': 'text/plain', 'language': None, 'base': 'https://www.sciencedaily.com/rss/health_medicine/heart_disease.xml', 'value': 'Novel electrocardiogram uses signals from ear and hand to check heart rhythm'}",2019-03-27 15:47:31.683934
False,,https://www.sciencedaily.com/releases/2019/03/190318132554.htm,https://www.sciencedaily.com/releases/2019/03/190318132554.htm,"[{'rel': 'alternate', 'type': 'text/html', 'href': 'https://www.sciencedaily.com/releases/2019/03/190318132554.htm'}]","[{'url': 'https://www.sciencedaily.com/images/2019/03/190318132554-large.jpg', 'height': '260', 'width': '300'}]","Mon, 18 Mar 2019 13:25:54 EDT","[2019, 3, 18, 17, 25, 54, 0, 77, 0]","Scientists have found that they can reverse the desire to drink in alcohol-dependent rats -- with the flip of a switch. The researchers were able to use lasers to temporarily inactivate a specific neuronal population, reversing alcohol-seeking behavior and even reducing the physical symptoms of withdrawal.","{'type': 'text/html', 'language': None, 'base': 'https://www.sciencedaily.com/rss/health_medicine/nervous_system.xml', 'value': 'Scientists have found that they can reverse the desire to drink in alcohol-dependent rats -- with the flip of a switch. The researchers were able to use lasers to temporarily inactivate a specific neuronal population, reversing alcohol-seeking behavior and even reducing the physical symptoms of withdrawal.'}",Scientists hunt down the brain circuit responsible for alcohol cravings,"{'type': 'text/plain', 'language': None, 'base': 'https://www.sciencedaily.com/rss/health_medicine/nervous_system.xml', 'value': 'Scientists hunt down the brain circuit responsible for alcohol cravings'}",2019-03-27 15:47:31.683934
False,,https://www.sciencedaily.com/releases/2019/03/190315125246.htm,https://www.sciencedaily.com/releases/2019/03/190315125246.htm,"[{'rel': 'alternate', 'type': 'text/html', 'href': 'https://www.sciencedaily.com/releases/2019/03/190315125246.htm'}]","[{'url': 'https://www.sciencedaily.com/images/2019/03/190315125246-large.jpg', 'height': '300', 'width': '300'}]","Fri, 15 Mar 2019 12:52:46 EDT","[2019, 3, 15, 16, 52, 46, 4, 74, 0]","When a muscle grows or a muscle injury heals, some of the stem cells develop into new muscle cells. A research team has now described how this process is regulated by two proteins produced in an oscillatory manner.","{'type': 'text/html', 'language': None, 'base': 'https://www.sciencedaily.com/rss/health_medicine/stem_cells.xml', 'value': 'When a muscle grows or a muscle injury heals, some of the stem cells develop into new muscle cells. A research team has now described how this process is regulated by two proteins produced in an oscillatory manner.'}",Oscillation in muscle tissue,"{'type': 'text/plain', 'language': None, 'base': 'https://www.sciencedaily.com/rss/health_medicine/stem_cells.xml', 'value': 'Oscillation in muscle tissue'}",2019-03-27 15:47:31.683934
False,,https://www.sciencedaily.com/releases/2019/03/190306143022.htm,https://www.sciencedaily.com/releases/2019/03/190306143022.htm,"[{'rel': 'alternate', 'type': 'text/html', 'href': 'https://www.sciencedaily.com/releases/2019/03/190306143022.htm'}]","[{'url': 'https://www.sciencedaily.com/images/2019/03/190306143022-large.jpg', 'height': '200', 'width': '300'}]","Wed, 06 Mar 2019 14:30:22 EST","[2019, 3, 6, 19, 30, 22, 2, 65, 0]","Researchers have found a compound that may treat inflammatory bowel disease without directly targeting inflammation. The compound tamps down the activity of a gene linked to blood clotting. They discovered that the gene was turned on at sites of intestinal inflammation and damage, and blocking its activity reduces IBD symptoms in mice.","{'type': 'text/html', 'language': None, 'base': 'https://www.sciencedaily.com/rss/health_medicine/immune_system.xml', 'value': 'Researchers have found a compound that may treat inflammatory bowel disease without directly targeting inflammation. The compound tamps down the activity of a gene linked to blood clotting. They discovered that the gene was turned on at sites of intestinal inflammation and damage, and blocking its activity reduces IBD symptoms in mice.'}","Potential new therapy for Crohn's, colitis identified","{'type': 'text/plain', 'language': None, 'base': 'https://www.sciencedaily.com/rss/health_medicine/immune_system.xml', 'value': ""Potential new therapy for Crohn's, colitis identified""}",2019-03-27 15:47:31.683934
False,,https://www.sciencedaily.com/releases/2019/01/190102151215.htm,https://www.sciencedaily.com/releases/2019/01/190102151215.htm,"[{'rel': 'alternate', 'type': 'text/html', 'href': 'https://www.sciencedaily.com/releases/2019/01/190102151215.htm'}]","[{'url': 'https://www.sciencedaily.com/images/2019/01/190102151215-large.jpg', 'height': '225', 'width': '300'}]","Wed, 02 Jan 2019 15:12:15 EST","[2019, 1, 2, 20, 12, 15, 2, 2, 0]","In optogenetics, scientists use light to turn groups of neurons in the brain on or off. New research demonstrates a new optogenetics method that eliminates the need for bulky optical fibers, gives researchers more precise control of the light's intensity, and allows for stimulating multiple areas of the brain simultaneously.","{'type': 'text/html', 'language': None, 'base': 'https://www.sciencedaily.com/rss/health_medicine/medical_devices.xml', 'value': ""In optogenetics, scientists use light to turn groups of neurons in the brain on or off. New research demonstrates a new optogenetics method that eliminates the need for bulky optical fibers, gives researchers more precise control of the light's intensity, and allows for stimulating multiple areas of the brain simultaneously.""}",Controlling neurons with light -- but without wires or batteries,"{'type': 'text/plain', 'language': None, 'base': 'https://www.sciencedaily.com/rss/health_medicine/medical_devices.xml', 'value': 'Controlling neurons with light -- but without wires or batteries'}",2019-03-27 15:47:31.683934
False,,https://www.sciencedaily.com/releases/2019/03/190320141011.htm,https://www.sciencedaily.com/releases/2019/03/190320141011.htm,"[{'rel': 'alternate', 'type': 'text/html', 'href': 'https://www.sciencedaily.com/releases/2019/03/190320141011.htm'}]","[{'url': 'https://www.sciencedaily.com/images/2019/03/190320141011-large.jpg', 'height': '149', 'width': '300'}]","Wed, 20 Mar 2019 14:10:11 EDT","[2019, 3, 20, 18, 10, 11, 2, 79, 0]",Two proteins work hand in hand to ensure that the tumor cells of neuroblastoma can grow at full speed. A research team shows how the proteins can do this.,"{'type': 'text/html', 'language': None, 'base': 'https://www.sciencedaily.com/rss/health_medicine/cancer.xml', 'value': 'Two proteins work hand in hand to ensure that the tumor cells of neuroblastoma can grow at full speed. A research team shows how the proteins can do this.'}",Protein BRCA1 as a stress coach,"{'type': 'text/plain', 'language': None, 'base': 'https://www.sciencedaily.com/rss/health_medicine/cancer.xml', 'value': 'Protein BRCA1 as a stress coach'}",2019-03-27 15:47:31.683934
False,,https://www.sciencedaily.com/releases/2019/02/190219111643.htm,https://www.sciencedaily.com/releases/2019/02/190219111643.htm,"[{'rel': 'alternate', 'type': 'text/html', 'href': 'https://www.sciencedaily.com/releases/2019/02/190219111643.htm'}]","[{'url': 'https://www.sciencedaily.com/images/2019/02/190219111643-large.jpg', 'height': '116', 'width': '300'}]","Tue, 19 Feb 2019 11:16:43 EST","[2019, 2, 19, 16, 16, 43, 1, 50, 0]","Scientists have managed to restore hearing in an adult mouse model of DFNB9 deafness -- a hearing disorder that represents one of the most frequent cases of congenital genetic deafness. Individuals with DFNB9 deafness are profoundly deaf as they are deficient in the gene coding for otoferlin, a protein which is essential for transmitting sound information at the auditory sensory cell synapses.","{'type': 'text/html', 'language': None, 'base': 'https://www.sciencedaily.com/rss/health_medicine/gene_therapy.xml', 'value': 'Scientists have managed to restore hearing in an adult mouse model of DFNB9 deafness -- a hearing disorder that represents one of the most frequent cases of congenital genetic deafness. Individuals with DFNB9 deafness are profoundly deaf as they are deficient in the gene coding for otoferlin, a protein which is essential for transmitting sound information at the auditory sensory cell synapses.'}",Gene therapy durably reverses congenital deafness in mice,"{'type': 'text/plain', 'language': None, 'base': 'https://www.sciencedaily.com/rss/health_medicine/gene_therapy.xml', 'value': 'Gene therapy durably reverses congenital deafness in mice'}",2019-03-27 15:47:31.683934
False,,https://www.sciencedaily.com/releases/2019/02/190208094324.htm,https://www.sciencedaily.com/releases/2019/02/190208094324.htm,"[{'rel': 'alternate', 'type': 'text/html', 'href': 'https://www.sciencedaily.com/releases/2019/02/190208094324.htm'}]","[{'url': 'https://www.sciencedaily.com/images/2019/02/190208094324-large.jpg', 'height': '255', 'width': '300'}]","Fri, 08 Feb 2019 09:43:24 EST","[2019, 2, 8, 14, 43, 24, 4, 39, 0]",Researchers have used human embryonic stem cells to create a new model system that allows them to study the initiation and progression of small cell lung cancer (SCLC). The study reveals the distinct roles played by two critical tumor suppressor genes that are commonly mutated in these highly lethal cancers.,"{'type': 'text/html', 'language': None, 'base': 'https://www.sciencedaily.com/rss/health_medicine/stem_cells.xml', 'value': 'Researchers have used human embryonic stem cells to create a new model system that allows them to study the initiation and progression of small cell lung cancer (SCLC). The study reveals the distinct roles played by two critical tumor suppressor genes that are commonly mutated in these highly lethal cancers.'}",Researchers develop human cell-based model to study small cell lung cancer,"{'type': 'text/plain', 'language': None, 'base': 'https://www.sciencedaily.com/rss/health_medicine/stem_cells.xml', 'value': 'Researchers develop human cell-based model to study small cell lung cancer'}",2019-03-27 15:47:31.683934
False,,https://www.sciencedaily.com/releases/2019/03/190319100735.htm,https://www.sciencedaily.com/releases/2019/03/190319100735.htm,"[{'rel': 'alternate', 'type': 'text/html', 'href': 'https://www.sciencedaily.com/releases/2019/03/190319100735.htm'}]","[{'url': 'https://www.sciencedaily.com/images/2019/03/190319100735-large.jpg', 'height': '228', 'width': '300'}]","Tue, 19 Mar 2019 10:07:35 EDT","[2019, 3, 19, 14, 7, 35, 1, 78, 0]","In the Americas, primate species likely to harbor Zika -- and potentially transmit the virus -- are common, abundant, and often live near people. So reports a new study.","{'type': 'text/html', 'language': None, 'base': 'https://www.sciencedaily.com/rss/health_medicine/viruses.xml', 'value': 'In the Americas, primate species likely to harbor Zika -- and potentially transmit the virus -- are common, abundant, and often live near people. So reports a new study.'}",New model IDs primate species with potential to spread Zika in the Americas,"{'type': 'text/plain', 'language': None, 'base': 'https://www.sciencedaily.com/rss/health_medicine/viruses.xml', 'value': 'New model IDs primate species with potential to spread Zika in the Americas'}",2019-03-27 15:47:31.683934
False,,https://www.sciencedaily.com/releases/2019/02/190219132853.htm,https://www.sciencedaily.com/releases/2019/02/190219132853.htm,"[{'rel': 'alternate', 'type': 'text/html', 'href': 'https://www.sciencedaily.com/releases/2019/02/190219132853.htm'}]","[{'url': 'https://www.sciencedaily.com/images/2019/02/190219132853-large.jpg', 'height': '144', 'width': '300'}]","Tue, 19 Feb 2019 13:28:53 EST","[2019, 2, 19, 18, 28, 53, 1, 50, 0]",A team of researchers under the direction of the Medical Center -- University of Freiburg has created an entirely new map of the brain's own immune system in humans and mice.,"{'type': 'text/html', 'language': None, 'base': 'https://www.sciencedaily.com/rss/health_medicine/nervous_system.xml', 'value': ""A team of researchers under the direction of the Medical Center -- University of Freiburg has created an entirely new map of the brain's own immune system in humans and mice.""}",Scientists create new map of brain's immune system,"{'type': 'text/plain', 'language': None, 'base': 'https://www.sciencedaily.com/rss/health_medicine/nervous_system.xml', 'value': ""Scientists create new map of brain's immune system""}",2019-03-27 15:47:31.683934
False,,https://www.sciencedaily.com/releases/2019/02/190220103341.htm,https://www.sciencedaily.com/releases/2019/02/190220103341.htm,"[{'rel': 'alternate', 'type': 'text/html', 'href': 'https://www.sciencedaily.com/releases/2019/02/190220103341.htm'}]","[{'url': 'https://www.sciencedaily.com/images/2019/02/190220103341-large.jpg', 'height': '92', 'width': '300'}]","Wed, 20 Feb 2019 10:33:41 EST","[2019, 2, 20, 15, 33, 41, 2, 51, 0]","A new study has found that transplanting the bone marrow of young laboratory mice into old mice prevented cognitive decline in the old mice, preserving their memory and learning abilities. The findings support an emerging model that attributes cognitive decline, in part, to aging of blood cells, which are produced in bone marrow.","{'type': 'text/html', 'language': None, 'base': 'https://www.sciencedaily.com/rss/health_medicine/stem_cells.xml', 'value': 'A new study has found that transplanting the bone marrow of young laboratory mice into old mice prevented cognitive decline in the old mice, preserving their memory and learning abilities. The findings support an emerging model that attributes cognitive decline, in part, to aging of blood cells, which are produced in bone marrow.'}",Young bone marrow rejuvenates aging mouse brains,"{'type': 'text/plain', 'language': None, 'base': 'https://www.sciencedaily.com/rss/health_medicine/stem_cells.xml', 'value': 'Young bone marrow rejuvenates aging mouse brains'}",2019-03-27 15:47:31.683934
False,,https://www.sciencedaily.com/releases/2019/03/190313150219.htm,https://www.sciencedaily.com/releases/2019/03/190313150219.htm,"[{'rel': 'alternate', 'type': 'text/html', 'href': 'https://www.sciencedaily.com/releases/2019/03/190313150219.htm'}]","[{'url': 'https://www.sciencedaily.com/images/2019/03/190313150219-large.jpg', 'height': '83', 'width': '300'}]","Wed, 13 Mar 2019 15:02:19 EDT","[2019, 3, 13, 19, 2, 19, 2, 72, 0]","Using roundworms, one of Earth's simplest animals, bioscientists have found the first direct link between a diet containing too little vitamin B12 and an increased risk of infection by two potentially deadly pathogens.","{'type': 'text/html', 'language': None, 'base': 'https://www.sciencedaily.com/rss/health_medicine/cancer.xml', 'value': ""Using roundworms, one of Earth's simplest animals, bioscientists have found the first direct link between a diet containing too little vitamin B12 and an increased risk of infection by two potentially deadly pathogens.""}",Danger of vitamin B12 deficiency,"{'type': 'text/plain', 'language': None, 'base': 'https://www.sciencedaily.com/rss/health_medicine/cancer.xml', 'value': 'Danger of vitamin B12 deficiency'}",2019-03-27 15:47:31.683934
False,,https://www.sciencedaily.com/releases/2018/04/180426125937.htm,https://www.sciencedaily.com/releases/2018/04/180426125937.htm,"[{'rel': 'alternate', 'type': 'text/html', 'href': 'https://www.sciencedaily.com/releases/2018/04/180426125937.htm'}]","[{'url': 'https://www.sciencedaily.com/images/2018/04/180426125937-large.jpg', 'height': '119', 'width': '300'}]","Thu, 26 Apr 2018 12:59:37 EDT","[2018, 4, 26, 16, 59, 37, 3, 116, 0]","Biomedical engineers have used a CRISPR/Cas9 genetic engineering technique to turn off a gene that regulates cholesterol levels in adult mice, leading to reduced blood cholesterol levels and gene repression lasting for six months after a single treatment. This marks the first time researchers have delivered CRISPR/Cas9 repressors for targeted therapeutic gene silencing in adult animal models.","{'type': 'text/html', 'language': None, 'base': 'https://www.sciencedaily.com/rss/health_medicine/gene_therapy.xml', 'value': 'Biomedical engineers have used a CRISPR/Cas9 genetic engineering technique to turn off a gene that regulates cholesterol levels in adult mice, leading to reduced blood cholesterol levels and gene repression lasting for six months after a single treatment. This marks the first time researchers have delivered CRISPR/Cas9 repressors for targeted therapeutic gene silencing in adult animal models.'}",CRISPR/Cas9 silences gene associated with high cholesterol,"{'type': 'text/plain', 'language': None, 'base': 'https://www.sciencedaily.com/rss/health_medicine/gene_therapy.xml', 'value': 'CRISPR/Cas9 silences gene associated with high cholesterol'}",2019-03-27 15:47:31.683934
False,,https://www.sciencedaily.com/releases/2019/03/190321200605.htm,https://www.sciencedaily.com/releases/2019/03/190321200605.htm,"[{'rel': 'alternate', 'type': 'text/html', 'href': 'https://www.sciencedaily.com/releases/2019/03/190321200605.htm'}]","[{'url': 'https://www.sciencedaily.com/images/2019/03/190321200605-large.jpg', 'height': '171', 'width': '300'}]","Thu, 21 Mar 2019 20:06:05 EDT","[2019, 3, 22, 0, 6, 5, 4, 81, 0]",A new combination treatment aimed at resistant and recurrent low-grade gliomas slowed tumor growth and killed tumor cells in laboratory and mouse models.,"{'type': 'text/html', 'language': None, 'base': 'https://www.sciencedaily.com/rss/health_medicine/pharmaceuticals.xml', 'value': 'A new combination treatment aimed at resistant and recurrent low-grade gliomas slowed tumor growth and killed tumor cells in laboratory and mouse models.'}",New drug combination shows promise for common pediatric brain tumor,"{'type': 'text/plain', 'language': None, 'base': 'https://www.sciencedaily.com/rss/health_medicine/pharmaceuticals.xml', 'value': 'New drug combination shows promise for common pediatric brain tumor'}",2019-03-27 15:47:31.683934
False,,https://www.sciencedaily.com/releases/2019/03/190327112610.htm,https://www.sciencedaily.com/releases/2019/03/190327112610.htm,"[{'rel': 'alternate', 'type': 'text/html', 'href': 'https://www.sciencedaily.com/releases/2019/03/190327112610.htm'}]","[{'url': 'https://www.sciencedaily.com/images/2019/03/190327112610-large.jpg', 'height': '170', 'width': '300'}]","Wed, 27 Mar 2019 11:26:10 EDT","[2019, 3, 27, 15, 26, 10, 2, 86, 0]","Researchers have solved the structures of the cancer-promoting enzymes USP25 and USP28, and identified significant differences in their activities. Both enzymes promote the growth of various tumors. The results could benefit towards the development of new, low-side-effects anticancer drugs.","{'type': 'text/html', 'language': None, 'base': 'https://www.sciencedaily.com/rss/health_medicine/cancer.xml', 'value': 'Researchers have solved the structures of the cancer-promoting enzymes USP25 and USP28, and identified significant differences in their activities. Both enzymes promote the growth of various tumors. The results could benefit towards the development of new, low-side-effects anticancer drugs.'}",Tumor-promoting enzymes USP25 and USP28: Substantial differences identified,"{'type': 'text/plain', 'language': None, 'base': 'https://www.sciencedaily.com/rss/health_medicine/cancer.xml', 'value': 'Tumor-promoting enzymes USP25 and USP28: Substantial differences identified'}",2019-03-27 15:47:31.683934
False,,https://www.sciencedaily.com/releases/2019/02/190213142700.htm,https://www.sciencedaily.com/releases/2019/02/190213142700.htm,"[{'rel': 'alternate', 'type': 'text/html', 'href': 'https://www.sciencedaily.com/releases/2019/02/190213142700.htm'}]","[{'url': 'https://www.sciencedaily.com/images/2019/02/190213142700-large.jpg', 'height': '188', 'width': '300'}]","Wed, 13 Feb 2019 14:27:00 EST","[2019, 2, 13, 19, 27, 0, 2, 44, 0]","In a randomized, controlled pilot trial, researchers found that participants pre-treated with noninvasive vagus nerve stimulation experienced less pain after heat stimulus than mock-treated participants.","{'type': 'text/html', 'language': None, 'base': 'https://www.sciencedaily.com/rss/health_medicine/nervous_system.xml', 'value': 'In a randomized, controlled pilot trial, researchers found that participants pre-treated with noninvasive vagus nerve stimulation experienced less pain after heat stimulus than mock-treated participants.'}",Stimulating the vagus nerve in the neck might help ease pain associated with PTSD,"{'type': 'text/plain', 'language': None, 'base': 'https://www.sciencedaily.com/rss/health_medicine/nervous_system.xml', 'value': 'Stimulating the vagus nerve in the neck might help ease pain associated with PTSD'}",2019-03-27 15:47:31.683934
False,,https://www.sciencedaily.com/releases/2019/02/190221122917.htm,https://www.sciencedaily.com/releases/2019/02/190221122917.htm,"[{'rel': 'alternate', 'type': 'text/html', 'href': 'https://www.sciencedaily.com/releases/2019/02/190221122917.htm'}]","[{'url': 'https://www.sciencedaily.com/images/2019/02/190221122917-large.jpg', 'height': '194', 'width': '300'}]","Thu, 21 Feb 2019 12:29:17 EST","[2019, 2, 21, 17, 29, 17, 3, 52, 0]","The use of stem cells to repair organs is one of the foremost goals of modern regenerative medicine. Scientists have discovered that the protein Akna plays a key role in this process. It controls, for example, the behavior of neural stem cells via a mechanism that may also be involved in the formation of metastases.","{'type': 'text/html', 'language': None, 'base': 'https://www.sciencedaily.com/rss/health_medicine/stem_cells.xml', 'value': 'The use of stem cells to repair organs is one of the foremost goals of modern regenerative medicine. Scientists have discovered that the protein Akna plays a key role in this process. It controls, for example, the behavior of neural stem cells via a mechanism that may also be involved in the formation of metastases.'}",New mechanisms regulating neural stem cells,"{'type': 'text/plain', 'language': None, 'base': 'https://www.sciencedaily.com/rss/health_medicine/stem_cells.xml', 'value': 'New mechanisms regulating neural stem cells'}",2019-03-27 15:47:31.683934
False,,https://www.sciencedaily.com/releases/2018/03/180316153856.htm,https://www.sciencedaily.com/releases/2018/03/180316153856.htm,"[{'rel': 'alternate', 'type': 'text/html', 'href': 'https://www.sciencedaily.com/releases/2018/03/180316153856.htm'}]","[{'url': 'https://www.sciencedaily.com/images/2018/03/180316153856-large.jpg', 'height': '200', 'width': '300'}]","Fri, 16 Mar 2018 15:38:56 EDT","[2018, 3, 16, 19, 38, 56, 4, 75, 0]",A new study calls attention to post-storm hazards posed to tree care workers and provides safety recommendations.,"{'type': 'text/html', 'language': None, 'base': 'https://www.sciencedaily.com/rss/health_medicine/workplace_health.xml', 'value': 'A new study calls attention to post-storm hazards posed to tree care workers and provides safety recommendations.'}",Tree care workers need better training to handle dangers on the job,"{'type': 'text/plain', 'language': None, 'base': 'https://www.sciencedaily.com/rss/health_medicine/workplace_health.xml', 'value': 'Tree care workers need better training to handle dangers on the job'}",2019-03-27 15:47:31.683934
